<?xml version="1.0" encoding="UTF-8"?>
<xsd:schema xmlns:xsd="http://www.w3.org/2001/XMLSchema">
	<xsd:element name="venda">
		<xsd:complexType>
			<xsd:sequence>
				<xsd:element name="formaDePagamento" type="xsd:string" />
				<xsd:element name="produtos">
					<xsd:complexType>
						<xsd:sequence>
							<xsd:element ref="produto" maxOccurs="unbounded"></xsd:element>
						</xsd:sequence>
					</xsd:complexType>
				</xsd:element>
			</xsd:sequence>
			<xsd:attribute name="moeda" type="xsd:string"></xsd:attribute>
		</xsd:complexType>
	</xsd:element>

	<xsd:element name="produto">
		<xsd:complexType>
			<xsd:all>
				<xsd:element name="id" type="xsd:long"></xsd:element>
				<xsd:element name="nome" type="xsd:string"></xsd:element>
				<xsd:element name="valor" type="xsd:double"></xsd:element>
			</xsd:all>
		</xsd:complexType>
	</xsd:element>

</xsd:schema>